{
	"v": "0.2",
	"id": "https://example.com/events/tokyo-indie-games-expo-2027",
	"name": {
		"ja": "東京インディーゲームエキスポ2027",
		"en": "Tokyo Indie Games Expo 2027"
	},
	"venue": {
		"name": {
			"ja": "東京ビッグサイト",
			"en": "Tokyo Big Sight"
		},
		"address": "3-11-1 Ariake, Koto City, Tokyo",
		"countryCode": "JP",
		"components": [
			{
				"$type": "directory.evnt.component.placeId#0",
				"type": "org.openstreetmap.way",
				"id": "123456789"
			},
			{
				"$type": "directory.evnt.component.coordinates#0",
				"latitude": 35.6298,
				"longitude": 139.7942,
				"uncertainty": 200
			}
		]
	},
	"occurrences": [
		{
			"start": "2027-05-22T10:00[Asia/Tokyo]",
			"end": "2027-05-23T17:00[Asia/Tokyo]"
		}
	],
	"components": [
		{
			"$type": "directory.evnt.richtext.markdown#0",
			"content": "Two days of **playable demos** and talks from independent studios.",
			"language": "en",
			"flavor": "commonmark"
		},
		{
			"$type": "directory.evnt.component.link#0",
			"url": "https://example.com/tickets",
			"name": {
				"en": "Get Tickets",
				"ja": "チケット"
			}
		},
		{
			"$type": "directory.evnt.component.source#0",
			"url": "https://news.example.com/indie-games-expo-announced"
		},
		{
			"$type": "directory.evnt.component.splashMedia#0",
			"media": {
				"sources": [
					{
						"url": "https://example.com/poster.webp",
						"mimeType": "image/webp",
						"dimensions": {
							"width": 1080,
							"height": 1528
						}
					},
					{
						"url": "https://example.com/poster.jpg",
						"mimeType": "image/jpeg"
					}
				],
				"alt": {
					"en": "Pixel-art poster of the expo hall",
					"ja": "会場のドット絵ポスター"
				},
				"presentation": {
					"blurhash": "LEHV6nWB2yk8pyo0adR*.7kCMdnj",
					"dominantColor": "#2b1d3a"
				}
			},
			"roles": ["poster"]
		},
		{
			"$type": "directory.evnt.component.languages#0",
			"languages": [
				{
					"code": "ja"
				},
				{
					"code": "en"
				}
			]
		},
		{
			"$type": "directory.evnt.component.relation#0",
			"type": "parent",
			"target": "https://example.com/events/tokyo-indie-games-expo"
		}
	]
}
