{
	"v": "0.2",
	"id": "https://example.com/events/cine-zocalo-2026",
	"name": {
		"es-MX": "Cine al aire libre en el Zócalo",
		"en": "Open-air cinema at the Zócalo"
	},
	"status": "postponed",
	"venue": {
		"name": {
			"es": "Zócalo"
		},
		"address": "Plaza de la Constitución, Centro, Ciudad de México",
		"countryCode": "MX",
		"components": [
			{
				"$type": "directory.evnt.component.coordinates#0",
				"latitude": 19.4326,
				"longitude": -99.1332,
				"uncertainty": 150
			}
		]
	},
	"occurrences": [
		{
			"start": "2026-08-01T20:00[America/Mexico_City]",
			"end": "2026-08-01T23:30[America/Mexico_City]"
		}
	]
}
